{
  "network": "solana",
  "version": 1,
  "program_ids": ["11111111111111111111111111111111"],
  "allowed_mints": [],
  "writable_accounts": ["11111111111111111111111111111111"],
  "max_lamports": "100000000",
  "max_slippage_bps": 100,
  "expiry": "2030-01-01T00:00:00Z",
  "simulation_required": true,
  "status": "ACTIVE"
}
